{"artifact_integrity":"verified","continuity":"verified","installation_authority":"authorized","key_status":"active","local_persona_id":"11111111-2222-3333-4444-555555555555","local_persona_root_sha256":"c0c0c0c0c0c0c0c0c0c0c0c0c0c0c0c0c0c0c0c0c0c0c0c0c0c0c0c0c0c0c0c0","proof_sha256":"b4b4b4b4b4b4b4b4b4b4b4b4b4b4b4b4b4b4b4b4b4b4b4b4b4b4b4b4b4b4b4b4","registry_status":"active","schema":"urn:a-quo:omarchy-plugin-publisher-evidence:v1","signature":"verified","signed_label_agreement":true,"signed_persona":"OracleJuniper","signing_key_fingerprint":"SHA256:AAAAAAAAAAAAAAAAAAAAAAAAAAAAAAAAAAAAAAAAAAA","subject":{"analysis_stream_schema":"a-quo-regular-file-stream-v1","analysis_stream_sha256":"b9b9b9b9b9b9b9b9b9b9b9b9b9b9b9b9b9b9b9b9b9b9b9b9b9b9b9b9b9b9b9b9","analysis_stream_size":223,"artifact_sha256":"b0b0b0b0b0b0b0b0b0b0b0b0b0b0b0b0b0b0b0b0b0b0b0b0b0b0b0b0b0b0b0b0","artifact_size":120,"manifest_sha256":"b2b2b2b2b2b2b2b2b2b2b2b2b2b2b2b2b2b2b2b2b2b2b2b2b2b2b2b2b2b2b2b2","package_format":"omarchy-zstd-tar-v1","plugin_id":"org.a-quo.oracle","plugin_version":"2.1.0"}}