{"artifact_integrity":"verified","continuity":"verified","installation_authority":"authorized","key_status":"active","local_persona_id":"11111111-2222-3333-4444-555555555555","local_persona_root_sha256":"c0c0c0c0c0c0c0c0c0c0c0c0c0c0c0c0c0c0c0c0c0c0c0c0c0c0c0c0c0c0c0c0","proof_sha256":"a3a3a3a3a3a3a3a3a3a3a3a3a3a3a3a3a3a3a3a3a3a3a3a3a3a3a3a3a3a3a3a3","registry_status":"active","schema":"urn:a-quo:omarchy-plugin-publisher-evidence:v1","signature":"verified","signed_label_agreement":true,"signed_persona":"OracleJuniper","signing_key_fingerprint":"SHA256:AAAAAAAAAAAAAAAAAAAAAAAAAAAAAAAAAAAAAAAAAAA","subject":{"analysis_stream_schema":"a-quo-regular-file-stream-v1","analysis_stream_sha256":"a9a9a9a9a9a9a9a9a9a9a9a9a9a9a9a9a9a9a9a9a9a9a9a9a9a9a9a9a9a9a9a9","analysis_stream_size":158,"artifact_sha256":"a0a0a0a0a0a0a0a0a0a0a0a0a0a0a0a0a0a0a0a0a0a0a0a0a0a0a0a0a0a0a0a0","artifact_size":100,"manifest_sha256":"a1a1a1a1a1a1a1a1a1a1a1a1a1a1a1a1a1a1a1a1a1a1a1a1a1a1a1a1a1a1a1a1","package_format":"omarchy-zstd-tar-v1","plugin_id":"org.a-quo.oracle","plugin_version":"2.0.0"}}