{"artifact_integrity":"verified","continuity":"verified","installation_authority":"authorized","key_status":"active","local_persona_id":"01234567-89ab-cdef-0123-456789abcdef","local_persona_root_sha256":"5555555555555555555555555555555555555555555555555555555555555555","proof_sha256":"ffffffffffffffffffffffffffffffffffffffffffffffffffffffffffffffff","registry_status":"active","schema":"urn:a-quo:omarchy-plugin-publisher-evidence:v1","signature":"verified","signed_label_agreement":true,"signed_persona":"JuniperQuill","signing_key_fingerprint":"SHA256:AAAAAAAAAAAAAAAAAAAAAAAAAAAAAAAAAAAAAAAAAAA","subject":{"analysis_stream_schema":"a-quo-regular-file-stream-v1","analysis_stream_sha256":"dddddddddddddddddddddddddddddddddddddddddddddddddddddddddddddddd","analysis_stream_size":223,"artifact_sha256":"cccccccccccccccccccccccccccccccccccccccccccccccccccccccccccccccc","artifact_size":120,"manifest_sha256":"3333333333333333333333333333333333333333333333333333333333333333","package_format":"omarchy-zstd-tar-v1","plugin_id":"test.risk-contract","plugin_version":"1.1.0"}}